{
  "schema_version": "internal.tradeability_snapshot.v1",
  "tradeability_snapshot_id": "tradeability_btc_001",
  "evidence_bundle_id": "evidence_btc_momentum_extended_001",
  "measurements": {
    "tradeability": 31,
    "entry_quality": 22,
    "risk": 92,
    "cost_adjusted_edge": 11
  },
  "market_context": {
    "liquidity_status": "acceptable",
    "spread_status": "wide_for_chasing",
    "timing_status": "extended_after_move"
  },
  "lineage": {
    "claim_packet_id": "claim_btc_momentum_extended_001",
    "evidence_bundle_id": "evidence_btc_momentum_extended_001",
    "market_snapshot_ids": ["public_market_snapshot_001"]
  }
}
